{"authority":{"executionAuthority":"NONE","freeSqlAccepted":false,"mutationAuthority":"NONE","proposalOnly":true,"providerCallPerformed":false},"canonicalResult":{"byteIdentical":true,"diskReadbackValidated":true,"run1Sha256":"e907b98ee1049fae4456cb74195727e1cde63adae304e1817a5820b419906d70","run2Sha256":"e907b98ee1049fae4456cb74195727e1cde63adae304e1817a5820b419906d70","runtimeValidated":true},"fixtureId":"ks-analysis-wave2-e2e-v1","groundTruth":{"afterSha256":"f8ae76b899211f9350bf6560ed4f90279a4ead0c138038cfa1901201eb853ed8","beforeSha256":"f8ae76b899211f9350bf6560ed4f90279a4ead0c138038cfa1901201eb853ed8","unchanged":true},"image":{"manifestDigest":"sha256:94f23d40fdaf5e60cb2fd8a98c22f02a7b8724949f310d95a0ddf075e8c8b208","platform":"linux/amd64","reference":"docker.io/library/postgres@sha256:94f23d40fdaf5e60cb2fd8a98c22f02a7b8724949f310d95a0ddf075e8c8b208"},"nonClaims":["Local synthetic PostgreSQL 16.10 evidence only; no production, customer-data, HA, performance, TLS or version-breadth claim.","The inferred relationship is a review-required proposal based on one local aggregate snapshot, not semantic FK truth.","Composite, expression and partial unique targets are outside this Wave 2 candidate model."],"privacy":{"credentialCanaryMatches":0,"dsnMatches":0,"outsideCanaryMatches":0,"rawRowCanaryMatches":0,"rawValueFields":0},"schemaVersion":"kaleidosphere.analysis/postgresql-wave2-e2e-readback/v1","summary":{"computedFacts":1,"declaredForeignKeysExcluded":true,"evaluatedPairs":1,"evidenceStoreFacts":6,"highConfidenceCandidates":1,"inferredCandidates":1,"observedFacts":4,"planSteps":4,"profiledColumns":3}}
